key,level,English,Japanese,Chinese
,,,,
hbs_dominion,0,Dominion: Charge up a slice by#200 for every primary hit.,Dominion: Charge up a slice by#200 for every primary hit.,Dominion: Charge up a slice by#200 for every primary hit.
hbs_paradox,0,"Paradox Barrier: When standing still, shields you from damage once. When moving, deal#20% more damage.","Paradox Barrier: When standing still, shields you from damage once. When moving, deal#20% more damage.","Paradox Barrier: When standing still, shields you from damage once. When moving, deal#20% more damage."
,,,,
hbs_inferno,0,"Inferno: Afflicted enemies take#30% more damage. Deals damage upon wearing off,#2x the damage of the hit that applied superburn.","Blazing: Afflicted enemies take#30% more damage. Deals damage upon wearing off,#2x the damage of the hit that applied superburn.","Blazing: Afflicted enemies take#30% more damage. Deals damage upon wearing off,#2x the damage of the hit that applied superburn."