key,level,English,Japanese,Chinese
,,,,
hbs_dominion,0,Dominion: Shields you once. Upon disappearing remove bullets in a large radius.,Dominion: Charge up a slice by#200 for every primary hit.,Dominion: Charge up a slice by#200 for every primary hit.
hbs_paradox_shield,0,"Paradox Barrier: Shield. Significantly reduces movement speed. Upon breaking, grant [PARADOXSWORD]","Paradox Barrier: When standing still, shields you from damage once. When moving, deal#20% more damage.","Paradox Barrier: When standing still, shields you from damage once. When moving, deal#20% more damage."
hbs_paradox_sword,0,"Paradox Barrier: Your Primary deals 10% more damage.","Paradox Barrier: When standing still, shields you from damage once. When moving, deal#20% more damage.","Paradox Barrier: When standing still, shields you from damage once. When moving, deal#20% more damage."
,,,,
hbs_inferno,0,"Inferno: Afflicted enemies take#5% more damage. Deals damage upon wearing off,#half the damage of the hit that applied superburn.","Blazing: Afflicted enemies take#30% more damage. Deals damage upon wearing off,#2x the damage of the hit that applied superburn.","Blazing: Afflicted enemies take#30% more damage. Deals damage upon wearing off,#2x the damage of the hit that applied superburn."